{
  "open_connections": [
    {
      "room_b": "room-outside", 
      "room_a": "room-0", 
      "area_m2": 0.90000000000000002
    }, 
    {
      "room_b": "room-outside", 
      "room_a": "room-0", 
      "area_m2": 2.3999999999999999
    }, 
    {
      "room_b": "room-outside", 
      "room_a": "room-0", 
      "area_m2": 2.3999999999999999
    }, 
    {
      "room_b": "room-outside", 
      "room_a": "room-0", 
      "area_m2": 2.3999999999999999
    }, 
    {
      "room_b": "room-outside", 
      "room_a": "room-2", 
      "area_m2": 2.2999999999999998
    }, 
    {
      "room_b": "room-outside", 
      "room_a": "room-2", 
      "area_m2": 2.2999999999999998
    }, 
    {
      "room_b": "room-outside", 
      "room_a": "room-4", 
      "area_m2": 1.5
    }, 
    {
      "room_b": "room-outside", 
      "room_a": "room-4", 
      "area_m2": 1.5
    }, 
    {
      "room_b": "room-outside", 
      "room_a": "room-4", 
      "area_m2": 1.5
    }, 
    {
      "room_b": "room-outside", 
      "room_a": "room-5", 
      "area_m2": 0.90000000000000002
    }, 
    {
      "room_b": "room-outside", 
      "room_a": "room-5", 
      "area_m2": 2.2999999999999998
    }, 
    {
      "room_b": "room-outside", 
      "room_a": "room-5", 
      "area_m2": 2.2999999999999998
    }, 
    {
      "room_b": "room-outside", 
      "room_a": "room-5", 
      "area_m2": 2.2999999999999998
    }, 
    {
      "room_b": "room-outside", 
      "room_a": "room-6", 
      "area_m2": 2.1000000000000001
    }, 
    {
      "room_b": "room-outside", 
      "room_a": "room-6", 
      "area_m2": 2.1000000000000001
    }, 
    {
      "room_b": "room-outside", 
      "room_a": "room-6", 
      "area_m2": 0.90000000000000002
    }, 
    {
      "room_b": "room-outside", 
      "room_a": "room-6", 
      "area_m2": 0.90000000000000002
    }, 
    {
      "room_b": "room-outside", 
      "room_a": "room-6", 
      "area_m2": 0.90000000000000002
    }, 
    {
      "room_b": "room-outside", 
      "room_a": "room-6", 
      "area_m2": 1.6000000000000001
    }, 
    {
      "room_b": "room-outside", 
      "room_a": "room-6", 
      "area_m2": 0.90000000000000002
    }, 
    {
      "room_b": "room-outside", 
      "room_a": "room-6", 
      "area_m2": 0.90000000000000002
    }, 
    {
      "room_b": "room-outside", 
      "room_a": "room-6", 
      "area_m2": 0.90000000000000002
    }, 
    {
      "room_b": "room-outside", 
      "room_a": "room-6", 
      "area_m2": 1.5
    }, 
    {
      "room_b": "room-outside", 
      "room_a": "room-6", 
      "area_m2": 0.90000000000000002
    }, 
    {
      "room_b": "room-outside", 
      "room_a": "room-6", 
      "area_m2": 0.90000000000000002
    }, 
    {
      "room_b": "room-outside", 
      "room_a": "room-6", 
      "area_m2": 0.90000000000000002
    }, 
    {
      "room_b": "room-outside", 
      "room_a": "room-6", 
      "area_m2": 2.2999999999999998
    }, 
    {
      "room_b": "room-outside", 
      "room_a": "room-6", 
      "area_m2": 2.2999999999999998
    }, 
    {
      "room_b": "room-outside", 
      "room_a": "room-6", 
      "area_m2": 2.2999999999999998
    }, 
    {
      "room_b": "room-outside", 
      "room_a": "room-8", 
      "area_m2": 2.3999999999999999
    }, 
    {
      "room_b": "room-outside", 
      "room_a": "room-8", 
      "area_m2": 1.6000000000000001
    }, 
    {
      "room_b": "room-outside", 
      "room_a": "room-8", 
      "area_m2": 1.6000000000000001
    }, 
    {
      "room_b": "room-outside", 
      "room_a": "room-8", 
      "area_m2": 1.5
    }, 
    {
      "room_b": "room-outside", 
      "room_a": "room-8", 
      "area_m2": 2.3999999999999999
    }, 
    {
      "room_b": "room-outside", 
      "room_a": "room-8", 
      "area_m2": 1.6000000000000001
    }, 
    {
      "room_b": "room-outside", 
      "room_a": "room-8", 
      "area_m2": 1.6000000000000001
    }, 
    {
      "room_b": "room-outside", 
      "room_a": "room-8", 
      "area_m2": 1.5
    }, 
    {
      "room_b": "room-outside", 
      "room_a": "room-8", 
      "area_m2": 2.2999999999999998
    }, 
    {
      "room_b": "room-outside", 
      "room_a": "room-8", 
      "area_m2": 2.2999999999999998
    }, 
    {
      "room_b": "room-outside", 
      "room_a": "room-8", 
      "area_m2": 2.2999999999999998
    }, 
    {
      "room_b": "room-outside", 
      "room_a": "room-9", 
      "area_m2": 1.5
    }, 
    {
      "room_b": "room-outside", 
      "room_a": "room-9", 
      "area_m2": 1.5
    }, 
    {
      "room_b": "room-outside", 
      "room_a": "room-9", 
      "area_m2": 1.6000000000000001
    }, 
    {
      "room_b": "room-outside", 
      "room_a": "room-9", 
      "area_m2": 1.6000000000000001
    }, 
    {
      "room_b": "room-outside", 
      "room_a": "room-9", 
      "area_m2": 2.3999999999999999
    }, 
    {
      "room_b": "room-outside", 
      "room_a": "room-9", 
      "area_m2": 1.5
    }, 
    {
      "room_b": "room-outside", 
      "room_a": "room-9", 
      "area_m2": 1.6000000000000001
    }, 
    {
      "room_b": "room-outside", 
      "room_a": "room-9", 
      "area_m2": 1.6000000000000001
    }, 
    {
      "room_b": "room-outside", 
      "room_a": "room-9", 
      "area_m2": 1.6000000000000001
    }, 
    {
      "room_b": "room-outside", 
      "room_a": "room-9", 
      "area_m2": 1.6000000000000001
    }, 
    {
      "room_b": "room-outside", 
      "room_a": "room-9", 
      "area_m2": 1.6000000000000001
    }, 
    {
      "room_b": "room-outside", 
      "room_a": "room-9", 
      "area_m2": 2.3999999999999999
    }, 
    {
      "room_b": "room-outside", 
      "room_a": "room-9", 
      "area_m2": 1.5
    }
  ], 
  "version": "1.0", 
  "source": "revit-raycast", 
  "project_name": "3056_BWK_r25_v2_jochem5MVUT", 
  "rooms": [
    {
      "id": "room-0", 
      "revit_id": 6954043, 
      "name": "Slaapkamer", 
      "height_m": 2.4399999999999999, 
      "type": "heated", 
      "level": "00_begane grond", 
      "volume_m3": 27.210000000000001, 
      "area_m2": 11.150000000000000
    }, 
    {
      "id": "room-1", 
      "revit_id": 6954044, 
      "name": "Mk", 
      "height_m": 2.4399999999999999, 
      "type": "heated", 
      "level": "00_begane grond", 
      "volume_m3": 1.6799999999999999, 
      "area_m2": 0.68999999999999995
    }, 
    {
      "id": "room-2", 
      "revit_id": 6954034, 
      "name": "Finse sauna", 
      "height_m": 2.4399999999999999, 
      "type": "heated", 
      "level": "00_begane grond", 
      "volume_m3": 10.930000000000000, 
      "area_m2": 4.4800000000000004
    }, 
    {
      "id": "room-3", 
      "revit_id": 6954035, 
      "name": "Badkamer 1", 
      "height_m": 2.4399999999999999, 
      "type": "heated", 
      "level": "00_begane grond", 
      "volume_m3": 19.520000000000000, 
      "area_m2": 8.0
    }, 
    {
      "id": "room-4", 
      "revit_id": 6954036, 
      "name": "Werkkamer", 
      "height_m": 2.4399999999999999, 
      "type": "heated", 
      "level": "00_begane grond", 
      "volume_m3": 39.280000000000001, 
      "area_m2": 16.100000000000001
    }, 
    {
      "id": "room-5", 
      "revit_id": 6954037, 
      "name": "Gastenverblijf", 
      "height_m": 2.4399999999999999, 
      "type": "heated", 
      "level": "00_begane grond", 
      "volume_m3": 22.370000000000001, 
      "area_m2": 9.1699999999999999
    }, 
    {
      "id": "room-6", 
      "revit_id": 6954038, 
      "name": "Entree/Hal/", 
      "height_m": 2.4399999999999999, 
      "type": "heated", 
      "level": "00_begane grond", 
      "volume_m3": 29.280000000000001, 
      "area_m2": 12.0
    }, 
    {
      "id": "room-7", 
      "revit_id": 6954039, 
      "name": "Toilet/Douche", 
      "height_m": 2.4399999999999999, 
      "type": "heated", 
      "level": "00_begane grond", 
      "volume_m3": 6.6399999999999997, 
      "area_m2": 2.7200000000000002
    }, 
    {
      "id": "room-8", 
      "revit_id": 6954040, 
      "name": "Zithoek", 
      "height_m": 2.4399999999999999, 
      "type": "heated", 
      "level": "00_begane grond", 
      "volume_m3": 46.579999999999998, 
      "area_m2": 19.090000000000000
    }, 
    {
      "id": "room-9", 
      "revit_id": 6954041, 
      "name": "Leefkeuken", 
      "height_m": 2.4399999999999999, 
      "type": "heated", 
      "level": "00_begane grond", 
      "volume_m3": 71.780000000000001, 
      "area_m2": 29.420000000000002
    }, 
    {
      "id": "room-outside", 
      "type": "outside", 
      "name": "Buiten"
    }, 
    {
      "id": "room-water", 
      "type": "water", 
      "name": "Water"
    }
  ], 
  "exported_at": "2026-04-09T18:00:16", 
  "constructions": [
    {
      "id": "constr-0", 
      "layers": [
        {
          "distance_from_interior_mm": 0.0, 
          "type": "solid", 
          "lambda": 0.022700000000000001, 
          "thickness_mm": 95, 
          "material": "f7_gips_beplating_wand_610mm"
        }, 
        {
          "distance_from_interior_mm": 95.0, 
          "type": "air_gap", 
          "thickness_mm": 175, 
          "material": ""
        }, 
        {
          "distance_from_interior_mm": 270.0, 
          "type": "solid", 
          "lambda": 0.050200000000000002, 
          "thickness_mm": 18, 
          "material": "hout_multiplex_beplating_CE2+"
        }, 
        {
          "distance_from_interior_mm": 288.0, 
          "type": "solid", 
          "lambda": 0.9899, 
          "thickness_mm": 10, 
          "material": "keramische_tegel_150x150mm_wit"
        }
      ], 
      "room_b": "room-3", 
      "gross_area_m2": 3.0600000000000001, 
      "compass": "E", 
      "room_a": "room-0", 
      "orientation": "wall"
    }, 
    {
      "id": "constr-1", 
      "layers": [
        {
          "distance_from_interior_mm": 0.0, 
          "type": "solid", 
          "lambda": 0.022700000000000001, 
          "thickness_mm": 95,